{
  "$schema": "https://json-schema.org/draft/2020-12/schema",
  "$id": "CTR-SEC-001",
  "title": "Secret Reference / Handle",
  "description": "An opaque, scoped REFERENCE to a credential held by the secret registry. This document is what a module manifest, a log line, an event, a job and an audit record are permitted to carry. It never carries credential material in `handle`, and no property of this schema is intended to hold any. Note that `correlation_id`, `scope.workspace_id`, `rotation.owner.id` and `revocation.actor.id` are free-text strings: the schema cannot stop a producer pasting a credential into one, so a producer must not.",
  "type": "object",
  "additionalProperties": false,
  "required": [
    "handle",
    "scope",
    "ownership",
    "classification",
    "state",
    "resolvable",
    "rotation",
    "redaction"
  ],
  "properties": {
    "handle": {
      "type": "string",
      "pattern": "^secret:[a-z0-9._-]+$",
      "maxLength": 128,
      "x-source": "Decision Register 5.2 CTR-SEC-001 requires an 'opaque ref'; PT-010 requires that a manifest sees a REFERENCE only. The `secret:` prefix and body charset are ADOPTED FROM CTR-MOD-001 `secret_handles` so that the two contracts use one string form rather than two. The adoption does NOT make the two compose: CTR-SEC-001 bounds `handle` at maxLength 128 and CTR-MOD-001 `secret_handles.items` has no maxLength, so their accept sets differ, and the earlier justification that the two contracts compose is withdrawn until a probe shows equal accept sets (A1 condition C3). Decision Register 5.2 owns CTR-MOD-001 to A0 and CTR-SEC-001 to A0+A1. A1 DISPOSED of the ownership question on 2026-09-04 (evidence/WP-0A-CON-004/security-disposition-handle-ownership-a1.md §4): it RATIFIED this pattern on `handle` at Draft under conditions C1-C5, REFUSED to ratify the precedent that a single-owner contract may fix a jointly-owned contract's syntax, and REQUIRED a narrow RFC, opened by A0 as owner of CTR-MOD-001, that makes CTR-SEC-001 normative for handle syntax and CTR-MOD-001 referencing. What stays open is therefore that RFC and the handle ISSUANCE format A1 must specify through it, not a conflict either contract has conceded.",
      "x-maxlength-note": "DECLARED INFERENCE. The baseline states no length. 128 keeps a handle short enough to be an identifier in a log line; it is NOT a control against embedded credential material and must not be read as one.",
      "x-opacity-limitation": "THIS PATTERN IS NOT A SECURITY CONTROL, AND MUST NOT BE CITED AS ONE. Lowercase hex, lowercase base32 and lowercase dashed bot-token shapes all satisfy it. Independent security review measured the repository secret scanner (scripts/scan-repository-secrets.mjs) against 15 credential bodies this pattern admits and it detected 12. The pattern excludes every format carrying a mandatory uppercase character -- AWS, Meta, Google, JWT, SendGrid, Twilio -- not only mixed-case base64. The residual gap is 5 of 5 lowercase-canonical shapes: bare 32-hex, a UUID, an HMAC hex digest, a passphrase and a dotted-label password. An earlier version of this sentence said the two compose to ZERO coverage; A1 measured it and that was false in the alarming direction, which is as wrong as understating a surface. The real limitation is one of REACH, not of coverage: the scanner walks repository files at commit time and has none over a handle in a log, an event or a job, which is the surface PT-010 is about for a credential smuggled inside a conforming handle body. JSON Schema cannot distinguish a reference from the thing it refers to, and no shape rule available here can, so none is invented. What would close it is a handle ISSUANCE format -- an issuer-assigned, non-secret, non-guessable identifier that a producer cannot mint from credential material -- which the baseline does not specify. A1 (CTR-SEC-001 co-owner) must specify it before freeze. Demonstrated by examples/accepted-gap-structureless-handle-body.json."
    },
    "scope": {
      "type": "object",
      "additionalProperties": false,
      "required": [
        "workspace_id",
        "capability_key"
      ],
      "properties": {
        "workspace_id": {
          "type": "string",
          "minLength": 1
        },
        "business_profile_id": {
          "type": "string",
          "minLength": 1
        },
        "page_context_profile_id": {
          "type": "string",
          "minLength": 1
        },
        "capability_key": {
          "type": "string",
          "pattern": "^[a-z][a-z0-9.]*$"
        }
      },
      "x-source": "Decision Register 5.2 CTR-SEC-001 requires 'scope'; PT-010 produces a 'scoped credential resolver'; MR-004 produces a 'readiness result per capability/scope', which is why the scope is keyed by capability as well as tenant. The Workspace -> Business Profile -> Page Context nesting is DEC-010 and Workstream 3.1.",
      "x-cross-tenant-limitation": "This object records the scope a handle CLAIMS. Nothing here binds the claim to the handle: JSON Schema cannot compare one property's value against another's, so a document -- or a CTR-MOD-001 manifest listing the same handle string -- may assert a scope belonging to a different tenant and this contract will accept it. Independent security review raised exactly this. Enforcement belongs to the resolver named in PT-010, which must reject a resolution whose caller scope does not match the scope the registry recorded when the handle was issued. Declared in untestable_by_schema; NOT claimed as materialized."
    },
    "ownership": {
      "enum": [
        "managed",
        "byok"
      ],
      "x-source": "PT-010 inputs are 'managed/BYOK credentials'; DEC-014 opens Platform AI plus BYOK OpenAI; SEC-012 requires BYOK isolation and provider egress control."
    },
    "classification": {
      "enum": [
        "public",
        "internal",
        "confidential",
        "restricted"
      ],
      "x-source": "SEC-003 requires a Public/Internal/Confidential/Restricted matrix in which token and API key are classified. SEC-003 names the four classes but has NOT yet assigned the class a credential handle carries, so this contract enumerates the four and pins none. See accepted_gaps in the manifest."
    },
    "state": {
      "enum": [
        "active",
        "rotating",
        "revoked"
      ],
      "x-source": "Decision Register 5.2 CTR-SEC-001 requires 'rotation/revoke'; SEC-005 requires a secret to be 'encrypted, masked, rotated'; PT-010 requires that revocation is possible immediately."
    },
    "resolvable": {
      "type": "boolean",
      "x-source": "DECLARED INFERENCE from PT-010 'revoke immediately' and MR-004 'missing secret/scope/entitlement does not activate'. The baseline states revocation as a runtime effect; the only contract-level expression of it is whether the registry will still resolve this handle to a credential. Inferred from PT-010 and MR-004; not a field named in either."
    },
    "rotation": {
      "type": "object",
      "additionalProperties": false,
      "required": [
        "owner",
        "rotated_at"
      ],
      "properties": {
        "owner": {
          "type": "object",
          "additionalProperties": false,
          "required": [
            "kind",
            "id"
          ],
          "properties": {
            "kind": {
              "enum": [
                "platform_role",
                "workspace_owner"
              ]
            },
            "id": {
              "type": "string",
              "minLength": 1
            }
          },
          "x-source": "INF-006 requires 'rotation owner/date complete'. The owner is a TYPED reference rather than a free string because Workstream 3.1 forbids a free-string actor. The two kinds are the two credential ownerships PT-010 names: platform-managed and BYOK."
        },
        "rotated_at": {
          "type": "string",
          "format": "date-time"
        },
        "next_rotation_due_at": {
          "type": "string",
          "format": "date-time"
        }
      },
      "x-source": "INF-006 'rotation owner/date complete'; SEC-005 requires the secret to be rotated."
    },
    "redaction": {
      "type": "object",
      "additionalProperties": false,
      "required": [
        "browser_safe",
        "log_safe",
        "event_safe",
        "job_safe",
        "analytics_safe",
        "error_trace_safe"
      ],
      "properties": {
        "browser_safe": {
          "const": true
        },
        "log_safe": {
          "const": true
        },
        "event_safe": {
          "const": true
        },
        "job_safe": {
          "const": true
        },
        "analytics_safe": {
          "const": true
        },
        "error_trace_safe": {
          "const": true
        }
      },
      "x-source": "PT-010 requires that logs, events and jobs contain no secret; SEC-005 requires that browser, job, event and log never see plaintext; SEC-012 requires that a key does not enter analytics or an error trace. Each surface is a separate const true, so a document asserting that any one of them is unsafe is not a valid secret handle; each of the six is fixture-defended by an invalid-redaction-<surface>-false.json. That is a PRODUCER SELF-ATTESTATION, not evidence that any surface is actually free of plaintext. Decision Register 5.2 lists 'redaction tests' as a freeze artifact, meaning runtime tests over real log, event, job, analytics and trace output, and they do not exist."
    },
    "revocation": {
      "type": "object",
      "additionalProperties": false,
      "required": [
        "revoked_at",
        "actor",
        "reason_key"
      ],
      "properties": {
        "revoked_at": {
          "type": "string",
          "format": "date-time"
        },
        "actor": {
          "type": "object",
          "additionalProperties": false,
          "required": [
            "kind",
            "id"
          ],
          "properties": {
            "kind": {
              "enum": [
                "user",
                "system_actor"
              ]
            },
            "id": {
              "type": "string",
              "minLength": 1
            }
          }
        },
        "reason_key": {
          "type": "string",
          "pattern": "^secret\\.[a-z_.]+$"
        }
      },
      "x-source": "PT-010 requires immediate revocation; SEC-009 requires that a CREDENTIAL action records actor and correlation. SEC-009 does not name a reason: requiring `reason_key` is a DECLARED INFERENCE from OB-005's reason on an audited action. The reason is a stable key rather than prose because CTR-ERR-001 establishes Thai message keys for anything a person reads; that key-not-prose choice is a DECLARED INFERENCE from CTR-ERR-001 and CM-004."
    },
    "correlation_id": {
      "type": "string",
      "minLength": 1,
      "x-source": "SEC-009 requires actor AND correlation on a credential action; OB-001 requires one trace across the workflow."
    }
  },
  "allOf": [
    {
      "if": {
        "properties": {
          "state": {
            "const": "revoked"
          }
        },
        "required": [
          "state"
        ]
      },
      "then": {
        "required": [
          "revocation"
        ],
        "properties": {
          "resolvable": {
            "const": false
          }
        }
      },
      "x-rule": "PT-010 'revoke immediately' plus SEC-009 credential auditing: a revoked handle must no longer resolve, and must record when and by whom it was revoked (SEC-009 requires actor and correlation only). Requiring it to record WHY is a DECLARED INFERENCE from OB-005, which requires a reason on an audited action; SEC-009 does not name a reason. Corrected 2026-10-06: an earlier version cited SEC-009 for the 'why', which independent contract review (M4) showed SEC-009 does not say."
    },
    {
      "if": {
        "properties": {
          "state": {
            "const": "active"
          }
        },
        "required": [
          "state"
        ]
      },
      "then": {
        "properties": {
          "resolvable": {
            "const": true
          }
        },
        "not": {
          "required": [
            "revocation"
          ]
        }
      },
      "x-rule": "PT-010 and MR-004: an active handle is one the resolver will still resolve, and a handle carrying a revocation record is not active. `rotating` is deliberately left unconstrained on `resolvable` because the baseline states no rotation-overlap rule; see freeze_boundary."
    },
    {
      "if": {
        "properties": {
          "ownership": {
            "const": "managed"
          }
        },
        "required": [
          "ownership"
        ]
      },
      "then": {
        "properties": {
          "rotation": {
            "properties": {
              "owner": {
                "properties": {
                  "kind": {
                    "const": "platform_role"
                  }
                },
                "required": [
                  "kind"
                ]
              }
            },
            "required": [
              "owner"
            ]
          }
        }
      },
      "x-rule": "PT-010 distinguishes managed from BYOK credentials and INF-006 requires a named rotation owner: a platform-managed credential is rotated by a platform role."
    },
    {
      "if": {
        "properties": {
          "ownership": {
            "const": "byok"
          }
        },
        "required": [
          "ownership"
        ]
      },
      "then": {
        "properties": {
          "rotation": {
            "properties": {
              "owner": {
                "properties": {
                  "kind": {
                    "const": "workspace_owner"
                  }
                },
                "required": [
                  "kind"
                ]
              }
            },
            "required": [
              "owner"
            ]
          }
        }
      },
      "x-rule": "PT-010 managed/BYOK split with SEC-012 BYOK isolation: a customer-supplied key is rotated by the workspace that supplied it, not by a platform role."
    },
    {
      "if": {
        "required": [
          "revocation"
        ]
      },
      "then": {
        "properties": {
          "resolvable": {
            "const": false
          }
        }
      },
      "x-rule": "PT-010 'revoke immediately': a handle that carries a revocation record must not resolve, whatever its `state` says. allOf[0] binds this to `state: revoked` and allOf[1] keeps a revocation record off an `active` handle; without this clause a `rotating` handle could carry a complete revocation record and still declare `resolvable: true`, which is the revoked-but-still-resolving case PT-010 exists to forbid. Raised by A1 in security co-owner review of the Candidate promotion."
    }
  ]
}
