{
  "handle": "secret:platform.notification.email.synthetic-0010",
  "scope": {
    "workspace_id": "ws_synthetic_0010",
    "capability_key": "notification.email.send"
  },
  "ownership": "managed",
  "classification": "internal",
  "state": "active",
  "resolvable": true,
  "rotation": {
    "owner": { "kind": "platform_role", "id": "A1" },
    "rotated_at": "2026-08-01T03:00:00Z"
  },
  "redaction": {
    "browser_safe": true,
    "log_safe": true,
    "event_safe": true,
    "job_safe": true,
    "analytics_safe": true,
    "error_trace_safe": true
  }
}
