{
  "handle": "secret:platform.meta.publisher.synthetic-0003",
  "scope": {
    "workspace_id": "ws_synthetic_0003",
    "business_profile_id": "bp_synthetic_0003",
    "page_context_profile_id": "pc_synthetic_0003",
    "capability_key": "publish.meta.page"
  },
  "ownership": "managed",
  "classification": "restricted",
  "state": "revoked",
  "resolvable": false,
  "rotation": {
    "owner": { "kind": "platform_role", "id": "A1" },
    "rotated_at": "2026-07-15T02:00:00Z"
  },
  "redaction": {
    "browser_safe": true,
    "log_safe": true,
    "event_safe": true,
    "job_safe": true,
    "analytics_safe": true,
    "error_trace_safe": true
  },
  "revocation": {
    "revoked_at": "2026-08-31T11:42:00Z",
    "actor": { "kind": "user", "id": "user_synthetic_0003" },
    "reason_key": "secret.revoked.suspected_exposure"
  },
  "correlation_id": "corr_synthetic_0003"
}
