{
  "handle": "secret:byok.ws-synthetic-0002.ai.openai.0001",
  "scope": {
    "workspace_id": "ws_synthetic_0002",
    "capability_key": "ai.text.generate"
  },
  "ownership": "byok",
  "classification": "restricted",
  "state": "rotating",
  "resolvable": true,
  "rotation": {
    "owner": { "kind": "workspace_owner", "id": "ws_synthetic_0002" },
    "rotated_at": "2026-08-30T09:15:00Z",
    "next_rotation_due_at": "2026-09-30T09:15:00Z"
  },
  "redaction": {
    "browser_safe": true,
    "log_safe": true,
    "event_safe": true,
    "job_safe": true,
    "analytics_safe": true,
    "error_trace_safe": true
  },
  "correlation_id": "corr_synthetic_0002"
}
